{
  "dataset_name": "RIL GET 2027 Instrumentation + Cognitive Practice Bank",
  "version": "1.0.0",
  "generated_on": "2026-10-15",
  "total_questions": 105,
  "notice": "These are original synthetic practice questions based on public topic references. They are NOT official RIL questions, not leaked questions, and not verified recalls from the 2027 assessment. Current RIL listing confirms Cognitive Test + Subject Matter but does not disclose exact question count, duration, weighting, or topic-level syllabus.",
  "supported_tracks": [
    "cognitive",
    "instrumentation"
  ],
  "scoring_recommendation": {
    "correct": 1,
    "incorrect": 0,
    "unanswered": 0,
    "note": "Practice scoring only; do not present as official RIL scoring or negative-marking rules."
  },
  "questions": [
    {
      "id": "C001",
      "track": "cognitive",
      "topic": "Percentages",
      "difficulty": "easy",
      "question": "If 15% of a number is 72, what is the number?",
      "options": [
        {
          "id": "A",
          "text": "360"
        },
        {
          "id": "B",
          "text": "420"
        },
        {
          "id": "C",
          "text": "480"
        },
        {
          "id": "D",
          "text": "520"
        }
      ],
      "correct_option_id": "C",
      "correct_answer": "480",
      "explanation": "Let the number be x. 0.15x = 72, so x = 72 / 0.15 = 480.",
      "recommended_time_seconds": 35,
      "tags": [
        "percentage",
        "arithmetic"
      ],
      "provenance": {
        "kind": "original_synthetic_practice_question",
        "note": "Written for this practice bank; not represented as an official or recalled RIL examination question.",
        "topic_basis_source_ids": [
          "RIL-2027",
          "INDIABIX-PRACTICE"
        ]
      }
    },
    {
      "id": "C002",
      "track": "cognitive",
      "topic": "Ratios",
      "difficulty": "easy",
      "question": "A quantity is divided in the ratio 3:5. If the total is 64, what is the smaller share?",
      "options": [
        {
          "id": "A",
          "text": "20"
        },
        {
          "id": "B",
          "text": "24"
        },
        {
          "id": "C",
          "text": "32"
        },
        {
          "id": "D",
          "text": "40"
        }
      ],
      "correct_option_id": "B",
      "correct_answer": "24",
      "explanation": "Total parts = 3 + 5 = 8. Each part is 64 / 8 = 8. Smaller share = 3 × 8 = 24.",
      "recommended_time_seconds": 35,
      "tags": [
        "ratio",
        "arithmetic"
      ],
      "provenance": {
        "kind": "original_synthetic_practice_question",
        "note": "Written for this practice bank; not represented as an official or recalled RIL examination question.",
        "topic_basis_source_ids": [
          "RIL-2027",
          "INDIABIX-PRACTICE"
        ]
      }
    },
    {
      "id": "C003",
      "track": "cognitive",
      "topic": "Averages",
      "difficulty": "easy",
      "question": "The average of 12, 15, 18 and x is 17. Find x.",
      "options": [
        {
          "id": "A",
          "text": "21"
        },
        {
          "id": "B",
          "text": "22"
        },
        {
          "id": "C",
          "text": "23"
        },
        {
          "id": "D",
          "text": "24"
        }
      ],
      "correct_option_id": "C",
      "correct_answer": "23",
      "explanation": "Required total = 4 × 17 = 68. Known total = 12 + 15 + 18 = 45. Therefore x = 68 − 45 = 23.",
      "recommended_time_seconds": 40,
      "tags": [
        "average",
        "arithmetic"
      ],
      "provenance": {
        "kind": "original_synthetic_practice_question",
        "note": "Written for this practice bank; not represented as an official or recalled RIL examination question.",
        "topic_basis_source_ids": [
          "RIL-2027",
          "INDIABIX-PRACTICE"
        ]
      }
    },
    {
      "id": "C004",
      "track": "cognitive",
      "topic": "Time and Work",
      "difficulty": "medium",
      "question": "Worker A completes a job in 12 days and worker B in 18 days. Working together at constant rates, how long will they take?",
      "options": [
        {
          "id": "A",
          "text": "6 days"
        },
        {
          "id": "B",
          "text": "7.2 days"
        },
        {
          "id": "C",
          "text": "8 days"
        },
        {
          "id": "D",
          "text": "9 days"
        }
      ],
      "correct_option_id": "B",
      "correct_answer": "7.2 days",
      "explanation": "Combined rate = 1/12 + 1/18 = 5/36 job per day. Time = 36/5 = 7.2 days.",
      "recommended_time_seconds": 55,
      "tags": [
        "time_work",
        "arithmetic"
      ],
      "provenance": {
        "kind": "original_synthetic_practice_question",
        "note": "Written for this practice bank; not represented as an official or recalled RIL examination question.",
        "topic_basis_source_ids": [
          "RIL-2027",
          "INDIABIX-PRACTICE"
        ]
      }
    },
    {
      "id": "C005",
      "track": "cognitive",
      "topic": "Speed Distance Time",
      "difficulty": "easy",
      "question": "A vehicle travels 180 km in 3.6 hours. What is its average speed?",
      "options": [
        {
          "id": "A",
          "text": "45 km/h"
        },
        {
          "id": "B",
          "text": "48 km/h"
        },
        {
          "id": "C",
          "text": "50 km/h"
        },
        {
          "id": "D",
          "text": "54 km/h"
        }
      ],
      "correct_option_id": "C",
      "correct_answer": "50 km/h",
      "explanation": "Average speed = distance / time = 180 / 3.6 = 50 km/h.",
      "recommended_time_seconds": 30,
      "tags": [
        "speed_distance_time"
      ],
      "provenance": {
        "kind": "original_synthetic_practice_question",
        "note": "Written for this practice bank; not represented as an official or recalled RIL examination question.",
        "topic_basis_source_ids": [
          "RIL-2027",
          "INDIABIX-PRACTICE"
        ]
      }
    },
    {
      "id": "C006",
      "track": "cognitive",
      "topic": "Profit and Loss",
      "difficulty": "easy",
      "question": "An item costs ₹600 and is sold for ₹720. What is the profit percentage on cost price?",
      "options": [
        {
          "id": "A",
          "text": "15%"
        },
        {
          "id": "B",
          "text": "18%"
        },
        {
          "id": "C",
          "text": "20%"
        },
        {
          "id": "D",
          "text": "25%"
        }
      ],
      "correct_option_id": "C",
      "correct_answer": "20%",
      "explanation": "Profit = 720 − 600 = ₹120. Profit percentage = 120/600 × 100 = 20%.",
      "recommended_time_seconds": 35,
      "tags": [
        "profit_loss"
      ],
      "provenance": {
        "kind": "original_synthetic_practice_question",
        "note": "Written for this practice bank; not represented as an official or recalled RIL examination question.",
        "topic_basis_source_ids": [
          "RIL-2027",
          "INDIABIX-PRACTICE"
        ]
      }
    },
    {
      "id": "C007",
      "track": "cognitive",
      "topic": "Simple Interest",
      "difficulty": "easy",
      "question": "What simple interest accrues on ₹8,000 at 7.5% per year for 2 years?",
      "options": [
        {
          "id": "A",
          "text": "₹900"
        },
        {
          "id": "B",
          "text": "₹1,000"
        },
        {
          "id": "C",
          "text": "₹1,200"
        },
        {
          "id": "D",
          "text": "₹1,500"
        }
      ],
      "correct_option_id": "C",
      "correct_answer": "₹1,200",
      "explanation": "SI = P × R × T / 100 = 8000 × 7.5 × 2 / 100 = ₹1,200.",
      "recommended_time_seconds": 40,
      "tags": [
        "simple_interest"
      ],
      "provenance": {
        "kind": "original_synthetic_practice_question",
        "note": "Written for this practice bank; not represented as an official or recalled RIL examination question.",
        "topic_basis_source_ids": [
          "RIL-2027",
          "INDIABIX-PRACTICE"
        ]
      }
    },
    {
      "id": "C008",
      "track": "cognitive",
      "topic": "Discounts",
      "difficulty": "medium",
      "question": "A product receives successive discounts of 10% and 20%. What is the equivalent single discount?",
      "options": [
        {
          "id": "A",
          "text": "26%"
        },
        {
          "id": "B",
          "text": "28%"
        },
        {
          "id": "C",
          "text": "30%"
        },
        {
          "id": "D",
          "text": "32%"
        }
      ],
      "correct_option_id": "B",
      "correct_answer": "28%",
      "explanation": "After 10% off, 90% remains. After a further 20% discount, 0.9 × 0.8 = 0.72 remains. Total discount = 1 − 0.72 = 28%.",
      "recommended_time_seconds": 45,
      "tags": [
        "discount",
        "percentages"
      ],
      "provenance": {
        "kind": "original_synthetic_practice_question",
        "note": "Written for this practice bank; not represented as an official or recalled RIL examination question.",
        "topic_basis_source_ids": [
          "RIL-2027",
          "INDIABIX-PRACTICE"
        ]
      }
    },
    {
      "id": "C009",
      "track": "cognitive",
      "topic": "Probability",
      "difficulty": "easy",
      "question": "Two fair coins are tossed. What is the probability of getting exactly one head?",
      "options": [
        {
          "id": "A",
          "text": "1/4"
        },
        {
          "id": "B",
          "text": "1/3"
        },
        {
          "id": "C",
          "text": "1/2"
        },
        {
          "id": "D",
          "text": "3/4"
        }
      ],
      "correct_option_id": "C",
      "correct_answer": "1/2",